{"approvalSubjectSha256":"074c583deb55cbb93ec614c887c60de97a2d877d9829ff4ffc9b75a9fe8ac313","authorityBoundary":"approval_only_no_deletion_authority","blockers":["dependency_approval_set_mismatch","unproven_compatibility_window","unproven_dependency_approval","unproven_independent_approval","unproven_usage_observation"],"decision":"blocked","gainLedgerProjection":{"evidenceCount":12,"gain":"Retire legacy branch run-code-intel.workflow-recommender.inline only through a separate deletion ticket","id":"retirement:retire-recommender-branch","status":"blocked"},"legacyBranch":{"affectedFiles":["run-code-intel.ps1"],"branchId":"run-code-intel.workflow-recommender.inline","callPath":"run-code-intel.ps1::run-code-intel.workflow-recommender.inline","capabilityId":"facade.workflow-recommender.inline","owner":"executor-recommender","registryParticipantId":"facade.workflow-recommender.inline"},"replacement":{"atomEvidence":{"artifactSchema":"code-intel-compatibility-retirement-evidence.v1","consumedSnapshotIdentity":"12ee02ae917ee80d351c4bd92d54cc9f5561630f694c2464b9d96f393f5d143d","path":"evidence/replacement-atom.json","schema":"code-intel-artifact-ref.v1","sha256":"ed0e23782542d7e0416f26d88ac4b4f2ef601b2e67efec1bf7678ad007900777","type":"compatibility.retirement-evidence"},"capabilityId":"advisory.workflow-recommend","dependencies":["repo.snapshot","project.orientation-benchmark"],"implementationId":"advisory.workflow-recommend.compat"},"retirementId":"retire-recommender-branch","schema":"code-intel-compatibility-retirement-decision.v1","snapshotIdentity":"12ee02ae917ee80d351c4bd92d54cc9f5561630f694c2464b9d96f393f5d143d"}