{"approvalSubjectSha256":"6f805b643318b280a5d8ca62ea923586b9f39e6c48ddd1cf025d94e467d0e123","authorityBoundary":"approval_only_no_deletion_authority","blockers":["unproven_compatibility_window","unproven_independent_approval","unproven_usage_observation"],"decision":"blocked","gainLedgerProjection":{"evidenceCount":12,"gain":"Retire legacy branch run-code-intel.provider-preflight.test-wrapper only through a separate deletion ticket","id":"retirement:retire-provider-preflight-branch","status":"blocked"},"legacyBranch":{"affectedFiles":["run-code-intel.ps1"],"branchId":"run-code-intel.provider-preflight.test-wrapper","callPath":"run-code-intel.ps1::run-code-intel.provider-preflight.test-wrapper","capabilityId":"facade.provider-preflight.test-wrapper","owner":"executor-provider-preflight","registryParticipantId":"facade.provider-preflight.test-wrapper"},"replacement":{"atomEvidence":{"artifactSchema":"code-intel-compatibility-retirement-evidence.v1","consumedSnapshotIdentity":"9b9e068a689bc5674ee759124d69800fd867d496e3a4109d0929dab0245d373e","path":"evidence/replacement-atom.json","schema":"code-intel-artifact-ref.v1","sha256":"a2606cacca2c4522fda9646e88b7ca1618ce080ec95e4ffa48faacf08488d895","type":"compatibility.retirement-evidence"},"capabilityId":"provider.repowise-adapt","dependencies":["repo.snapshot","evidence.admissibility"],"implementationId":"provider.repowise-adapt.compat"},"retirementId":"retire-provider-preflight-branch","schema":"code-intel-compatibility-retirement-decision.v1","snapshotIdentity":"9b9e068a689bc5674ee759124d69800fd867d496e3a4109d0929dab0245d373e"}