{"approvalSubjectSha256":"d7156017ea970d4b22216913e0b3a32e169ae28005aad85daf54dd6eee82d9d2","authorityBoundary":"approval_only_no_deletion_authority","blockers":["dependency_approval_set_mismatch","unproven_compatibility_window","unproven_contract_parity","unproven_dependency_approval","unproven_effect_parity","unproven_independent_approval","unproven_usage_observation"],"decision":"blocked","gainLedgerProjection":{"evidenceCount":12,"gain":"Retire legacy branch run-code-intel.publication.legacy-staging-marker only through a separate deletion ticket","id":"retirement:retire-publication-branch","status":"blocked"},"legacyBranch":{"affectedFiles":["run-code-intel.ps1"],"branchId":"run-code-intel.publication.legacy-staging-marker","callPath":"run-code-intel.ps1::run-code-intel.publication.legacy-staging-marker","capabilityId":"facade.publication.legacy-staging-marker","owner":"executor-publication","registryParticipantId":"facade.publication.legacy-staging-marker"},"replacement":{"atomEvidence":{"artifactSchema":"code-intel-compatibility-retirement-evidence.v1","consumedSnapshotIdentity":"1c095a2c79c7f3f4e30fe1d653abb9431c1e42f50c64b16f053a34133047c3a4","path":"evidence/replacement-atom.json","schema":"code-intel-artifact-ref.v1","sha256":"bb885da7adf445584a6988e36833636650181053fe74b43fd6fdf2d2fd766f7c","type":"compatibility.retirement-evidence"},"capabilityId":"run.commit","dependencies":["run.dag-coordinate","artifact.stage-transaction"],"implementationId":"run.commit.compat"},"retirementId":"retire-publication-branch","schema":"code-intel-compatibility-retirement-decision.v1","snapshotIdentity":"1c095a2c79c7f3f4e30fe1d653abb9431c1e42f50c64b16f053a34133047c3a4"}