{"approvalSubjectSha256":"8535c8f5df88026c8fce19a22431d7e244a37b6a5fc46a8d492d726adf45c8a6","authorityBoundary":"approval_only_no_deletion_authority","blockers":["unproven_compatibility_window","unproven_independent_approval","unproven_replacement_atom","unproven_usage_observation"],"decision":"blocked","gainLedgerProjection":{"evidenceCount":11,"gain":"Retire legacy branch invoke-code-intel.doctor.direct-production only through a separate deletion ticket","id":"retirement:retire-doctor-wrapper-branch","status":"blocked"},"legacyBranch":{"affectedFiles":["invoke-code-intel.ps1"],"branchId":"invoke-code-intel.doctor.direct-production","callPath":"invoke-code-intel.ps1::invoke-code-intel.doctor.direct-production","capabilityId":"doctor.bootstrap.direct-production","owner":"executor-doctor-wrapper","registryParticipantId":"doctor"},"replacement":{"atomEvidence":{"artifactSchema":"code-intel-compatibility-retirement-evidence.v1","consumedSnapshotIdentity":"ff712225ab6fea6d458a660b15350f3fcc75b8158c24ed7d995f6a786171365a","path":"evidence/replacement-atom.json","schema":"code-intel-artifact-ref.v1","sha256":"836ac097b69f6cd0e59b3335c039d01712200ab8631425e35b99d944bf1311fd","type":"compatibility.retirement-evidence"},"capabilityId":"doctor","dependencies":["repo.snapshot"],"implementationId":"doctor.envelope.compat"},"retirementId":"retire-doctor-wrapper-branch","schema":"code-intel-compatibility-retirement-decision.v1","snapshotIdentity":"ff712225ab6fea6d458a660b15350f3fcc75b8158c24ed7d995f6a786171365a"}