{"approvalSubjectSha256":"a9b07fdbb2933c5e95fdd69dd522277f4e07481f8e382766c9d79f3e46520fae","authorityBoundary":"approval_only_no_deletion_authority","blockers":["unproven_compatibility_window","unproven_independent_approval","unproven_replacement_atom","unproven_usage_observation"],"decision":"blocked","gainLedgerProjection":{"evidenceCount":12,"gain":"Retire legacy branch run-code-intel.hospital.embedded-diagnosis-render only through a separate deletion ticket","id":"retirement:retire-hospital-branch","status":"blocked"},"legacyBranch":{"affectedFiles":["run-code-intel.ps1"],"branchId":"run-code-intel.hospital.embedded-diagnosis-render","callPath":"run-code-intel.ps1::run-code-intel.hospital.embedded-diagnosis-render","capabilityId":"diagnosis.hospital.legacy-powershell","owner":"executor-hospital","registryParticipantId":"diagnosis.hospital"},"replacement":{"atomEvidence":{"artifactSchema":"code-intel-compatibility-retirement-evidence.v1","consumedSnapshotIdentity":"8a59ac498c518bff9ef60dcf09be003a33050074735e524bf67e1fd75938d880","path":"evidence/replacement-atom.json","schema":"code-intel-artifact-ref.v1","sha256":"e9d31ae78fbf5a2249e3f6f29077859bb8cf66b1417dbe78105f32f478a0826c","type":"compatibility.retirement-evidence"},"capabilityId":"diagnosis.hospital","dependencies":["integration.registry-reconcile","evidence.admissibility"],"implementationId":"diagnosis.hospital.compat"},"retirementId":"retire-hospital-branch","schema":"code-intel-compatibility-retirement-decision.v1","snapshotIdentity":"8a59ac498c518bff9ef60dcf09be003a33050074735e524bf67e1fd75938d880"}