{"approvalSubjectSha256":"63e573feb93cbff30a4ebc9a5f9fc306530f7e179c33046a64abfcc0252365a9","authorityBoundary":"approval_only_no_deletion_authority","blockers":["unproven_compatibility_window","unproven_independent_approval","unproven_replacement_atom","unproven_usage_observation"],"decision":"blocked","gainLedgerProjection":{"evidenceCount":12,"gain":"Retire legacy branch run-code-intel.native-code.embedded only through a separate deletion ticket","id":"retirement:retire-native-code-branch","status":"blocked"},"legacyBranch":{"affectedFiles":["run-code-intel.ps1"],"branchId":"run-code-intel.native-code.embedded","callPath":"run-code-intel.ps1::run-code-intel.native-code.embedded","capabilityId":"evidence.native-code.embedded","owner":"executor-native-code-retirement","registryParticipantId":"evidence.native-code"},"replacement":{"atomEvidence":{"artifactSchema":"code-intel-compatibility-retirement-evidence.v1","consumedSnapshotIdentity":"d8c543ac49a7d844f9ca03b9a9c75078da6842ec43499d8ba0d88eb176b17789","path":"evidence/replacement-atom.json","schema":"code-intel-artifact-ref.v1","sha256":"dd3c271aaa990e1d599dbd4aef4d6e1312d827ed6bb3d586c5f406c468c18fa9","type":"compatibility.retirement-evidence"},"capabilityId":"evidence.native-code","dependencies":["repo.snapshot","inventory.rg"],"implementationId":"evidence.native-code.compat"},"retirementId":"retire-native-code-branch","schema":"code-intel-compatibility-retirement-decision.v1","snapshotIdentity":"d8c543ac49a7d844f9ca03b9a9c75078da6842ec43499d8ba0d88eb176b17789"}