{"approvalSubjectSha256":"123924c9b337a5e8c8788033e410dbf831551c7c3c711af09c5b6a3fe4ff16f9","authorityBoundary":"approval_only_no_deletion_authority","blockers":["dependency_approval_set_mismatch","unproven_compatibility_window","unproven_dependency_approval","unproven_independent_approval","unproven_usage_observation"],"decision":"blocked","gainLedgerProjection":{"evidenceCount":11,"gain":"Retire legacy branch update-code-intel-index.legacy-compatibility-traversal only through a separate deletion ticket","id":"retirement:retire-index-branch","status":"blocked"},"legacyBranch":{"affectedFiles":["update-code-intel-index.ps1"],"branchId":"update-code-intel-index.legacy-compatibility-traversal","callPath":"update-code-intel-index.ps1::update-code-intel-index.legacy-compatibility-traversal","capabilityId":"artifact.index.legacy-powershell","owner":"executor-index","registryParticipantId":"artifact.index-committed-only"},"replacement":{"atomEvidence":{"artifactSchema":"code-intel-compatibility-retirement-evidence.v1","consumedSnapshotIdentity":"d6416367bf002a6ccea5a232910659627d3387942b144e86cf737180e5ab4fba","path":"evidence/replacement-atom.json","schema":"code-intel-artifact-ref.v1","sha256":"676a1db514f6c8e089243f4b308732dadb4e029731e6a53adfc2192c70950390","type":"compatibility.retirement-evidence"},"capabilityId":"artifact.index-committed-only","dependencies":["compatibility.retire-publication-branch"],"implementationId":"artifact.index-committed-only.compat"},"retirementId":"retire-index-branch","schema":"code-intel-compatibility-retirement-decision.v1","snapshotIdentity":"d6416367bf002a6ccea5a232910659627d3387942b144e86cf737180e5ab4fba"}